{
  "status": "active",
  "updatedAt": "2026-03-24",
  "policy": {
    "selectionRule": "When choosing the next Discovery-native internal slice, sort unresolved gaps by priority_score descending, then use worklist_rank as the tie-breaker before opening a bounded slice on the top-ranked gap.",
    "syncRule": "gap-worklist.json is generated from capability-gaps.json, intake-queue.json, and knowledge/active-mission.md through the canonical shared generator. Do not hand-edit item rows.",
    "openGapRule": "An unresolved gap may remain open after a completed queue candidate; keep it on the worklist until the underlying operating condition is actually closed."
  },
  "items": [
    {
      "gap_id": "gap-directive-engine-materialization",
      "worklist_rank": 1,
      "gap_priority": "high",
      "priority_score": 113,
      "score_breakdown": {
        "base_priority": 50,
        "mission_pressure": 5,
        "mission_leverage": 5,
        "proof_clarity": 1,
        "adaptation_leverage": 5,
        "blocker_severity": 0,
        "blocker_penalty": 0
      },
      "mission_objective": "Directive engine materialization",
      "gap_status": "in_progress",
      "next_slice_track": "discovery",
      "latest_candidate_id": "dw-live-gpt-researcher-engine-pressure-2026-03-24",
      "latest_candidate_status": "routed",
      "latest_result_path": "architecture/02-experiments/2026-03-24-dw-live-gpt-researcher-engine-pressure-2026-03-24-engine-handoff.md",
      "next_action": "Open the next bounded Architecture slice that converts the remaining gap into Directive-owned operating code.",
      "blocking_reason": null
    }
  ]
}
